{
  "schema": "https://bh-inf.github.io/time-capsule-snapshots/v1/schema/snapshot-v1.1.json",
  "schema_version": 1,
  "schema_minor": 1,
  "region": "TW",
  "date": "2026-10-24",
  "generated_at": "2026-10-24T04:33:26+08:00",
  "news": {
    "taiwan": [
      {
        "title": "視導薔琵颱風中央災害應變中心 卓揆：中央地方攜手防災 全力確保民眾安全",
        "source": "行政院",
        "url": "https://www.ey.gov.tw/NewOpenData/JSON/154",
        "fetched_at": "2026-10-24T04:33:26+08:00"
      },
      {
        "title": "因應數起疑似跨境鎮壓事件 卓揆責成檢警調強化情資掌握 保障國人人身安全",
        "source": "行政院",
        "url": "https://www.ey.gov.tw/NewOpenData/JSON/154",
        "fetched_at": "2026-10-24T04:33:26+08:00"
      },
      {
        "title": "卓揆：儘速研擬第二階段租稅優惠TISA方案 鼓勵國人及早累積退休資產",
        "source": "行政院",
        "url": "https://www.ey.gov.tw/NewOpenData/JSON/154",
        "fetched_at": "2026-10-24T04:33:26+08:00"
      },
      {
        "title": "卓揆：建置智能韌性設施農業及農機輔導體系 加速農業升級轉型與氣候調適能力",
        "source": "行政院",
        "url": "https://www.ey.gov.tw/NewOpenData/JSON/154",
        "fetched_at": "2026-10-24T04:33:26+08:00"
      },
      {
        "title": "政院通過「專利法」部分條文修正草案 促進設計產業專利布局及發展",
        "source": "行政院",
        "url": "https://www.ey.gov.tw/NewOpenData/JSON/154",
        "fetched_at": "2026-10-24T04:33:26+08:00"
      },
      {
        "title": "卓揆：超前部署因應薔琵颱風 共同守護人民生命財產安全",
        "source": "行政院",
        "url": "https://www.ey.gov.tw/NewOpenData/JSON/154",
        "fetched_at": "2026-10-24T04:33:26+08:00"
      },
      {
        "title": "政院嚴密掌握薔琵颱風動態 慎防強降雨及強風長浪 督促中央地方共同落實防災整備",
        "source": "行政院",
        "url": "https://www.ey.gov.tw/NewOpenData/JSON/154",
        "fetched_at": "2026-10-24T04:33:26+08:00"
      },
      {
        "title": "主持行政院永續會 卓揆：提升我國永續發展韌性 推動修訂政策綱領及發展目標",
        "source": "行政院",
        "url": "https://www.ey.gov.tw/NewOpenData/JSON/154",
        "fetched_at": "2026-10-24T04:33:26+08:00"
      }
    ],
    "world": [
      {
        "title": "英國發布《香港半年報告》指港府國安打壓延伸海外 並呼籲釋放黎智英",
        "source": "VOA",
        "url": "https://www.voachinese.com/a/uk-report-says-hong-kong-security-laws-reach-overseas-as-advocates-call-for-stronger-protection-20261023/8214560.html",
        "fetched_at": "2026-10-24T04:33:26+08:00"
      },
      {
        "title": "臺灣再次譴責中俄聯合公報“悖離事實”、“嚴重傷害”臺灣主權",
        "source": "VOA",
        "url": "https://www.voachinese.com/a/taiwan-condemns-china-russia-communique-over-sovereignty-20261023/8214480.html",
        "fetched_at": "2026-10-24T04:33:26+08:00"
      },
      {
        "title": "特朗普總統指責伊朗在美國中期選舉前詐稱襲船以“推高”油價",
        "source": "VOA",
        "url": "https://www.voachinese.com/a/president-trump-accuses-iran-of-faking-attacks-on-ships-to-drive-up-oil-prices-ahead-of-us-midterm-elections-20261022/8214234.html",
        "fetched_at": "2026-10-24T04:33:26+08:00"
      },
      {
        "title": "誰在破壞臺海和平？臺灣陸委會民調：過半臺人指中共",
        "source": "VOA",
        "url": "https://www.voachinese.com/a/poll-one-in-two-taiwanese-says-china-is-responsible-for-disability-in-taiwan-strait-20261022/8214219.html",
        "fetched_at": "2026-10-24T04:33:26+08:00"
      },
      {
        "title": "在美國推動重啟和平談判之際，俄羅斯與烏克蘭相互發動攻擊",
        "source": "VOA",
        "url": "https://www.voachinese.com/a/russia-ukraine-carry-out-attacks-amid-us-push-for-renewed-peace-talks-20261022/8214177.html",
        "fetched_at": "2026-10-24T04:33:26+08:00"
      },
      {
        "title": "調查報告：中俄防務合作加速升級 美國應加大創新並協調變裁",
        "source": "VOA",
        "url": "https://www.voachinese.com/a/china-russia-weapon-cooperation-c4ads-report-20261022/8213806.html",
        "fetched_at": "2026-10-24T04:33:26+08:00"
      },
      {
        "title": "菲律賓尋求與臺灣合作，保護海底電纜不受中國“灰色地帶”侵擾",
        "source": "VOA",
        "url": "https://www.voachinese.com/a/philippines-exploring-deeper-cooperation-with-taiwan-to-protect-cables-20261022/8214028.html",
        "fetched_at": "2026-10-24T04:33:26+08:00"
      },
      {
        "title": "臺灣政府嚴厲譴責中國跨境鎮壓傷害臺灣公民，籲民主夥伴共同抵制暴力捍衛人權",
        "source": "VOA",
        "url": "https://www.voachinese.com/a/taiwan-condemns-china-s-transnational-repression-in-hiring-locals-to-stage-accident-in-hurting-comedian-who-criticize-xi-20261021/8213819.html",
        "fetched_at": "2026-10-24T04:33:26+08:00"
      }
    ],
    "attributions": [
      {
        "source": "行政院",
        "license": "政府資料開放授權條款－第1版。使用時應註明出處。",
        "url": "https://data.gov.tw/license"
      },
      {
        "source": "VOA",
        "license": "VOA 自製內容屬於公有領域，引用請註明 VOA。已排除 AP、Reuters、AFP 素材。標題由簡體轉成繁體。",
        "url": "https://www.voanews.com/p/5338.html"
      }
    ],
    "filtered_wire_services": 0
  },
  "weather": {
    "source": "中央氣象署",
    "attribution": "中央氣象署開放資料（氣象資料開放平台）",
    "by_county": {
      "CYQ": {
        "name": "嘉義縣",
        "t_min_c": 25,
        "t_max_c": 26,
        "summary": "陰短暫陣雨",
        "note": null
      },
      "NWT": {
        "name": "新北市",
        "t_min_c": 25,
        "t_max_c": 25,
        "summary": "陰陣雨",
        "note": null
      },
      "CYI": {
        "name": "嘉義市",
        "t_min_c": 23,
        "t_max_c": 24,
        "summary": "陰短暫陣雨",
        "note": null
      },
      "HSQ": {
        "name": "新竹縣",
        "t_min_c": 24,
        "t_max_c": 25,
        "summary": "陰陣雨",
        "note": null
      },
      "HSZ": {
        "name": "新竹市",
        "t_min_c": 24,
        "t_max_c": 25,
        "summary": "陰陣雨",
        "note": null
      },
      "TPE": {
        "name": "臺北市",
        "t_min_c": 26,
        "t_max_c": 26,
        "summary": "陰陣雨",
        "note": null
      },
      "TNN": {
        "name": "臺南市",
        "t_min_c": 25,
        "t_max_c": 26,
        "summary": "陰短暫陣雨",
        "note": null
      },
      "ILA": {
        "name": "宜蘭縣",
        "t_min_c": 25,
        "t_max_c": 25,
        "summary": "陰陣雨",
        "note": null
      },
      "MIA": {
        "name": "苗栗縣",
        "t_min_c": 23,
        "t_max_c": 24,
        "summary": "陰陣雨",
        "note": null
      },
      "YUN": {
        "name": "雲林縣",
        "t_min_c": 24,
        "t_max_c": 25,
        "summary": "陰短暫陣雨",
        "note": null
      },
      "HUA": {
        "name": "花蓮縣",
        "t_min_c": 29,
        "t_max_c": 32,
        "summary": "陰短暫陣雨",
        "note": null
      },
      "TXG": {
        "name": "臺中市",
        "t_min_c": 25,
        "t_max_c": 25,
        "summary": "陰短暫陣雨",
        "note": null
      },
      "TTT": {
        "name": "臺東縣",
        "t_min_c": 27,
        "t_max_c": 30,
        "summary": "陰天",
        "note": null
      },
      "TAO": {
        "name": "桃園市",
        "t_min_c": 24,
        "t_max_c": 25,
        "summary": "陰陣雨",
        "note": null
      },
      "NAN": {
        "name": "南投縣",
        "t_min_c": 24,
        "t_max_c": 25,
        "summary": "陰短暫陣雨",
        "note": null
      },
      "KHH": {
        "name": "高雄市",
        "t_min_c": 26,
        "t_max_c": 27,
        "summary": "陰短暫陣雨",
        "note": null
      },
      "KIN": {
        "name": "金門縣",
        "t_min_c": 26,
        "t_max_c": 26,
        "summary": "多雲",
        "note": null
      },
      "PIF": {
        "name": "屏東縣",
        "t_min_c": 25,
        "t_max_c": 27,
        "summary": "陰短暫陣雨",
        "note": null
      },
      "KEE": {
        "name": "基隆市",
        "t_min_c": 25,
        "t_max_c": 26,
        "summary": "陰陣雨",
        "note": null
      },
      "PEN": {
        "name": "澎湖縣",
        "t_min_c": 25,
        "t_max_c": 26,
        "summary": "陰天",
        "note": null
      },
      "CHA": {
        "name": "彰化縣",
        "t_min_c": 25,
        "t_max_c": 25,
        "summary": "陰短暫陣雨",
        "note": null
      },
      "LIE": {
        "name": "連江縣",
        "t_min_c": 24,
        "t_max_c": 25,
        "summary": "陰短暫陣雨",
        "note": null
      }
    }
  },
  "songs": {
    "source": null,
    "chart_date": null,
    "items": [],
    "status": "unavailable",
    "note": "尚無允許公開再散布的排行榜來源"
  },
  "prices": [],
  "trends": {
    "source": "Google Trends",
    "attribution": "Google Trends。依 Google 服務條款使用；再使用時請註明 Google。https://support.google.com/trends/answer/4365538?hl=en",
    "items": [
      {
        "rank": 1,
        "term": "公鹿 對 公牛",
        "url": "https://trends.google.com/trends/explore?q=%E5%85%AC%E9%B9%BF+%E5%B0%8D+%E5%85%AC%E7%89%9B&geo=TW"
      },
      {
        "rank": 2,
        "term": "lec",
        "url": "https://trends.google.com/trends/explore?q=lec&geo=TW"
      },
      {
        "rank": 3,
        "term": "lpl",
        "url": "https://trends.google.com/trends/explore?q=lpl&geo=TW"
      },
      {
        "rank": 4,
        "term": "tes",
        "url": "https://trends.google.com/trends/explore?q=tes&geo=TW"
      },
      {
        "rank": 5,
        "term": "worlds 2026",
        "url": "https://trends.google.com/trends/explore?q=worlds+2026&geo=TW"
      },
      {
        "rank": 6,
        "term": "twitch",
        "url": "https://trends.google.com/trends/explore?q=twitch&geo=TW"
      },
      {
        "rank": 7,
        "term": "lol esport",
        "url": "https://trends.google.com/trends/explore?q=lol+esport&geo=TW"
      },
      {
        "rank": 8,
        "term": "riot",
        "url": "https://trends.google.com/trends/explore?q=riot&geo=TW"
      },
      {
        "rank": 9,
        "term": "cfo",
        "url": "https://trends.google.com/trends/explore?q=cfo&geo=TW"
      },
      {
        "rank": 10,
        "term": "avengers doomsday",
        "url": "https://trends.google.com/trends/explore?q=avengers+doomsday&geo=TW"
      }
    ]
  },
  "missing": [
    "prices",
    "songs"
  ],
  "signature": {
    "alg": "ed25519",
    "key_id": "2026-10",
    "sig": "LvQ/LZLk8kSwidZcMlzYf3GpNi5aBgfpShJHHLTLMnBTvD7ksgm5PSkKW59kwMRWdwdoMLx0XMCQofrCriuMDg=="
  }
}
