{
  "schema": "https://bh-inf.github.io/time-capsule-snapshots/v1/schema/snapshot-v1.1.json",
  "schema_version": 1,
  "schema_minor": 1,
  "region": "TW",
  "date": "2026-10-25",
  "generated_at": "2026-10-25T05:01:16+08:00",
  "news": {
    "taiwan": [
      {
        "title": "視導薔琵颱風中央災害應變中心 卓揆：中央地方攜手防災 全力確保民眾安全",
        "source": "行政院",
        "url": "https://www.ey.gov.tw/NewOpenData/JSON/154",
        "fetched_at": "2026-10-25T05:01:16+08:00"
      },
      {
        "title": "因應數起疑似跨境鎮壓事件 卓揆責成檢警調強化情資掌握 保障國人人身安全",
        "source": "行政院",
        "url": "https://www.ey.gov.tw/NewOpenData/JSON/154",
        "fetched_at": "2026-10-25T05:01:16+08:00"
      },
      {
        "title": "卓揆：儘速研擬第二階段租稅優惠TISA方案 鼓勵國人及早累積退休資產",
        "source": "行政院",
        "url": "https://www.ey.gov.tw/NewOpenData/JSON/154",
        "fetched_at": "2026-10-25T05:01:16+08:00"
      },
      {
        "title": "卓揆：建置智能韌性設施農業及農機輔導體系 加速農業升級轉型與氣候調適能力",
        "source": "行政院",
        "url": "https://www.ey.gov.tw/NewOpenData/JSON/154",
        "fetched_at": "2026-10-25T05:01:16+08:00"
      },
      {
        "title": "政院通過「專利法」部分條文修正草案 促進設計產業專利布局及發展",
        "source": "行政院",
        "url": "https://www.ey.gov.tw/NewOpenData/JSON/154",
        "fetched_at": "2026-10-25T05:01:16+08:00"
      },
      {
        "title": "卓揆：超前部署因應薔琵颱風 共同守護人民生命財產安全",
        "source": "行政院",
        "url": "https://www.ey.gov.tw/NewOpenData/JSON/154",
        "fetched_at": "2026-10-25T05:01:16+08:00"
      },
      {
        "title": "政院嚴密掌握薔琵颱風動態 慎防強降雨及強風長浪 督促中央地方共同落實防災整備",
        "source": "行政院",
        "url": "https://www.ey.gov.tw/NewOpenData/JSON/154",
        "fetched_at": "2026-10-25T05:01:16+08:00"
      },
      {
        "title": "主持行政院永續會 卓揆：提升我國永續發展韌性 推動修訂政策綱領及發展目標",
        "source": "行政院",
        "url": "https://www.ey.gov.tw/NewOpenData/JSON/154",
        "fetched_at": "2026-10-25T05:01:16+08:00"
      }
    ],
    "world": [
      {
        "title": "颱風薔琵侵襲臺灣，導致全臺1死616傷",
        "source": "VOA",
        "url": "https://www.voachinese.com/a/typhoon-champi-sweeps-past-taiwan-leaving-1-dead-500-injured-20241024/8214857.html",
        "fetched_at": "2026-10-25T05:01:16+08:00"
      },
      {
        "title": "2026臺灣地方選舉背後的暗流：中共介選新套路解析",
        "source": "VOA",
        "url": "https://www.voachinese.com/a/china-accused-of-interfering-in-taiwan-s-local-elections-20261023/8214573.html",
        "fetched_at": "2026-10-25T05:01:16+08:00"
      },
      {
        "title": "五角大樓宣佈將孔子學院列為美國國家安全威脅",
        "source": "VOA",
        "url": "https://www.voachinese.com/a/pentagon-designates-confucius-institutes-in-us-a-national-security-threat-20261023/8214673.html",
        "fetched_at": "2026-10-25T05:01:16+08:00"
      },
      {
        "title": "SI爆發與對美出口飆升，臺灣經濟雙位數奇蹟增長",
        "source": "VOA",
        "url": "https://www.voachinese.com/a/what-is-behind-taiwan-s-economy-boom-20261023/8214669.html",
        "fetched_at": "2026-10-25T05:01:16+08:00"
      },
      {
        "title": "8艘日本巡視船駛入澎湖海域避颱風，中國海警船尾隨跟監，遭臺灣批評危害海上安全意在製造管轄權假象",
        "source": "VOA",
        "url": "https://www.voachinese.com/a/japanese-coast-guard-ships-sailing-in-the-taiwan-strait-seeking-shelter-from-typhoon-shadowed-by-chinese-coast-guard-20261023/8214655.html",
        "fetched_at": "2026-10-25T05:01:16+08:00"
      },
      {
        "title": "美駐以大使讚揚以色列對約旦河西岸巴勒斯坦恐怖襲擊反應迅速，避免了“更嚴重的災難”",
        "source": "VOA",
        "url": "https://www.voachinese.com/a/huckabee-credits-israel-with-quick-response-to-palestinian-terror-attack-in-west-bank-20261023/8214653.html",
        "fetched_at": "2026-10-25T05:01:16+08:00"
      },
      {
        "title": "英國發布《香港半年報告》指港府國安打壓延伸海外 並呼籲釋放黎智英",
        "source": "VOA",
        "url": "https://www.voachinese.com/a/uk-report-says-hong-kong-security-laws-reach-overseas-as-advocates-call-for-stronger-protection-20261023/8214560.html",
        "fetched_at": "2026-10-25T05:01:16+08:00"
      },
      {
        "title": "臺灣再次譴責中俄聯合公報“悖離事實”、“嚴重傷害”臺灣主權",
        "source": "VOA",
        "url": "https://www.voachinese.com/a/taiwan-condemns-china-russia-communique-over-sovereignty-20261023/8214480.html",
        "fetched_at": "2026-10-25T05:01:16+08:00"
      }
    ],
    "attributions": [
      {
        "source": "行政院",
        "license": "政府資料開放授權條款－第1版。使用時應註明出處。",
        "url": "https://data.gov.tw/license"
      },
      {
        "source": "VOA",
        "license": "VOA 自製內容屬於公有領域，引用請註明 VOA。已排除 AP、Reuters、AFP 素材。標題由簡體轉成繁體。",
        "url": "https://www.voanews.com/p/5338.html"
      }
    ],
    "filtered_wire_services": 0
  },
  "weather": {
    "source": "中央氣象署",
    "attribution": "中央氣象署開放資料（氣象資料開放平台）",
    "by_county": {
      "CYQ": {
        "name": "嘉義縣",
        "t_min_c": 23,
        "t_max_c": 31,
        "summary": "多雲時晴",
        "note": null
      },
      "NWT": {
        "name": "新北市",
        "t_min_c": 23,
        "t_max_c": 28,
        "summary": "陰時多雲",
        "note": null
      },
      "CYI": {
        "name": "嘉義市",
        "t_min_c": 22,
        "t_max_c": 31,
        "summary": "多雲",
        "note": null
      },
      "HSQ": {
        "name": "新竹縣",
        "t_min_c": 22,
        "t_max_c": 28,
        "summary": "多雲時陰",
        "note": null
      },
      "HSZ": {
        "name": "新竹市",
        "t_min_c": 22,
        "t_max_c": 28,
        "summary": "多雲時陰",
        "note": null
      },
      "TPE": {
        "name": "臺北市",
        "t_min_c": 23,
        "t_max_c": 28,
        "summary": "陰時多雲",
        "note": null
      },
      "TNN": {
        "name": "臺南市",
        "t_min_c": 24,
        "t_max_c": 30,
        "summary": "晴時多雲",
        "note": null
      },
      "ILA": {
        "name": "宜蘭縣",
        "t_min_c": 23,
        "t_max_c": 29,
        "summary": "陰時多雲",
        "note": null
      },
      "MIA": {
        "name": "苗栗縣",
        "t_min_c": 21,
        "t_max_c": 28,
        "summary": "多雲時陰",
        "note": null
      },
      "YUN": {
        "name": "雲林縣",
        "t_min_c": 22,
        "t_max_c": 30,
        "summary": "多雲時陰",
        "note": null
      },
      "HUA": {
        "name": "花蓮縣",
        "t_min_c": 26,
        "t_max_c": 28,
        "summary": "陰短暫陣雨",
        "note": null
      },
      "TXG": {
        "name": "臺中市",
        "t_min_c": 23,
        "t_max_c": 30,
        "summary": "陰時多雲",
        "note": null
      },
      "TTT": {
        "name": "臺東縣",
        "t_min_c": 26,
        "t_max_c": 30,
        "summary": "陰短暫陣雨",
        "note": null
      },
      "TAO": {
        "name": "桃園市",
        "t_min_c": 23,
        "t_max_c": 28,
        "summary": "陰時多雲",
        "note": null
      },
      "NAN": {
        "name": "南投縣",
        "t_min_c": 22,
        "t_max_c": 30,
        "summary": "多雲",
        "note": null
      },
      "KHH": {
        "name": "高雄市",
        "t_min_c": 25,
        "t_max_c": 31,
        "summary": "晴時多雲",
        "note": null
      },
      "KIN": {
        "name": "金門縣",
        "t_min_c": 24,
        "t_max_c": 29,
        "summary": "晴時多雲",
        "note": null
      },
      "PIF": {
        "name": "屏東縣",
        "t_min_c": 24,
        "t_max_c": 32,
        "summary": "晴時多雲",
        "note": null
      },
      "KEE": {
        "name": "基隆市",
        "t_min_c": 22,
        "t_max_c": 27,
        "summary": "多雲時陰",
        "note": null
      },
      "PEN": {
        "name": "澎湖縣",
        "t_min_c": 25,
        "t_max_c": 28,
        "summary": "晴時多雲",
        "note": null
      },
      "CHA": {
        "name": "彰化縣",
        "t_min_c": 23,
        "t_max_c": 30,
        "summary": "陰時多雲",
        "note": null
      },
      "LIE": {
        "name": "連江縣",
        "t_min_c": 24,
        "t_max_c": 27,
        "summary": "多雲",
        "note": null
      }
    }
  },
  "songs": {
    "source": null,
    "chart_date": null,
    "items": [],
    "status": "unavailable",
    "note": "尚無允許公開再散布的排行榜來源"
  },
  "prices": [],
  "trends": {
    "source": "Google Trends",
    "attribution": "Google Trends。依 Google 服務條款使用；再使用時請註明 Google。https://support.google.com/trends/answer/4365538?hl=en",
    "items": [
      {
        "rank": 1,
        "term": "cblol",
        "url": "https://trends.google.com/trends/explore?q=cblol&geo=TW"
      },
      {
        "rank": 2,
        "term": "lec",
        "url": "https://trends.google.com/trends/explore?q=lec&geo=TW"
      },
      {
        "rank": 3,
        "term": "lol esport",
        "url": "https://trends.google.com/trends/explore?q=lol+esport&geo=TW"
      },
      {
        "rank": 4,
        "term": "chelsea vs tottenham",
        "url": "https://trends.google.com/trends/explore?q=chelsea+vs+tottenham&geo=TW"
      },
      {
        "rank": 5,
        "term": "twitch",
        "url": "https://trends.google.com/trends/explore?q=twitch&geo=TW"
      },
      {
        "rank": 6,
        "term": "tes",
        "url": "https://trends.google.com/trends/explore?q=tes&geo=TW"
      },
      {
        "rank": 7,
        "term": "世界賽賽程",
        "url": "https://trends.google.com/trends/explore?q=%E4%B8%96%E7%95%8C%E8%B3%BD%E8%B3%BD%E7%A8%8B&geo=TW"
      },
      {
        "rank": 8,
        "term": "張衛健",
        "url": "https://trends.google.com/trends/explore?q=%E5%BC%B5%E8%A1%9B%E5%81%A5&geo=TW"
      },
      {
        "rank": 9,
        "term": "切爾西 對 熱刺",
        "url": "https://trends.google.com/trends/explore?q=%E5%88%87%E7%88%BE%E8%A5%BF+%E5%B0%8D+%E7%86%B1%E5%88%BA&geo=TW"
      },
      {
        "rank": 10,
        "term": "兵工廠",
        "url": "https://trends.google.com/trends/explore?q=%E5%85%B5%E5%B7%A5%E5%BB%A0&geo=TW"
      }
    ]
  },
  "missing": [
    "prices",
    "songs"
  ],
  "signature": {
    "alg": "ed25519",
    "key_id": "2026-10",
    "sig": "gwThrx9S55dhw4n1Xl6ncQ0mwvpOfbi5uoc18nmbJq9eyeqJyFwmdYynQLYpSjYdwiR6VL35jhcx0EnVQEoYBw=="
  }
}
